player_name_canonical,search_query_used,game_date_reference,subreddit,post_id,post_title,post_body,post_score,post_num_comments_total,comments_scraped_count,post_url,post_created_utc,scraped_comments_sample,title_neg,title_neu,title_pos,title_compound,body_neg,body_neu,body_pos,body_compound,comments_neg,comments_neu,comments_pos,comments_compound
Shai Gilgeous-Alexander,"""Shai Gilgeous-Alexander"" OR ""Shai"" OR ""Gilgeous-Alexander"" OR ""The Shai""",2024-01-03,nbadiscussion,18yc5e2,Guys like shai is making me rethink the importance of getting low on drives,"Watching Shai beating the entire Celtics roster off the dribble the other day is nothing short of incredible. The thing that pops out the most watching shai is he doesn’t get that low when driving past defenders compared to the likes of Kyrie, AI, Rose, other great drivers in the past. He just sort of glides while staying half-upright.

I also see this from Curry, who dribbles with his torso quite upright, and yet still able to blow by people. I understand defenders have to respect Curry’s shot so much that he can get by them, but this is not the case for Shai since he’s not a volume 3pt shooter.

Growing up I was taught to get as low as possible when driving by defenders, but I’m not so sure if that’s really necessary anymore. My theory is that NBA defenders are subconsciously wired to react to players getting super low when driving, that their bodies don’t react when someone like Shai, who only slightly lowers his body on drives. What do you guys think?",288,59,30,https://www.reddit.com/r/nbadiscussion/comments/18yc5e2/guys_like_shai_is_making_me_rethink_the/,2024-01-04 07:35:27,"I feel like we need some video analysis of this to see what’s happening and the comparisons you’re trying to make.

Great topic btw!  I was wondering something similar lately related to the advice to “catch up to your shoulders” when driving, and to have a shin angle on drives that is parallel to the angle of your shoulders/torso. || Your observation is correct, but I would still emphasize “low man wins” to 99% of basketball players. Curry gets low when he’s dribbling in traffic. Shai is dangerous because he can play off the pivot and kill in the midrange, so defenders really have no sure fire way of stopping him- play too close he goes by, give space and he’s money. || Derek White is another guy that stays fully upright on drives. Whether or not this is effective seems dependent on the type of finisher you are. If you’re doing scoop or finger roll type layups, you’ll need to be low to get the angle. 

But if you release high, like a floater or teardrop, then upright would be better. || It is very important. Look at the people u listed who stay low and keep their centre of gravity low, none of them are above 6'3. Curry can do this because he is an excellent shooter off the dribble, he's not a slasher and he wants to be in rhythm when shooting, you cant do that when ur low and have your gears turned on to drive to the basket. Now, look at Shai: he's a 6'6 wing sized guard who is not the fastest or most athletic in NBA standards at all. What he does to get by people is his length and craft, that's the difference between him and someone shorter who needs to be stable and ready to push off in order to get to the rim. || I think the exception kinda proves the role.

Shai is a really unique player. I think it's extremely rare to have a guard that size, with that handle, with that speed, who's also extremely patient and has a mastery of timing and angles like he does.

The same way it's kinda hard to draw generalized conclusions from Curry, because literally no one else is bringing his combination of skills to the table. || Thanks for bringing this up.  I always thought he moved differently on drives that broke my brain when he gets to the rim.  I’ve seen it from other players as well.  Maybe when your handles and ability to create angles is that good you don’t need as low center of gravity to get past or deceive defenders.  It might also help them demonstrate the threat to shoot. || Big difference between where the depth is coming from. Ankle > knee > hip. I think shai gets quite low, almost entirely from his ankles and knees so it is subtle but he has a clear leverage advantage. Similar with curry. || Shai and Curry both aren't freak athletes in terms of explosion. Maybe thats why. They rely more on craft and skill to get to the rack, versus quickness and vertical leap. || Staying tall gives a player more options. It's usually you need to get low to get by someone because you can usually push off faster, but once you are by the initial defender, you need height to see more of the floor and the goal. Plus most players these days don't do straight line drives if they are the main ball handler. They stop and go a lot to keep pressure everywhere. || I really hope with all my heart that Shai is gonna be the face of the league in the next 10 years. 

This guy fucking killed us at the Fiba WC (im fr) but the way he plays and his charisma are really something else || Sga definitely gets low on his drives at 6’5, if you pay close attention you’ll also notice how much pressure he puts on his ankles and shins when he stops on the dime and changes direction. You can’t do that without getting low. || What you are taught to do and what nba players can do are wildly different. I don’t know you but do you have the ability to bend the defence to your will while you have the ball? Players like Steph, SGA and the like can so what they can do is different but for 99% of everyone else get low. || I might be crazy, but Shai's offensive game has always reminded me more of a less explosive, more slithery Pistons Grant Hill than any of the guards you listed. The hunchbacked dribble, aggressively tight hesis and crossovers, efficient spin moves, plus a ton of oddball finishes and creative dumpoffs in the paint - even their jumpshots look similarly weird to my eyes. It makes sense because SGA is closer in height to Hill than the guards you listed, but his skills combined with modern NBA spacing have allowed him to flourish as a self-creating scorer in a way the crafty wings of yesteryear could've only dreamed of. || While I appreciate your attention to detail and your analysis on how certain players have different techniques, I don't think you should be asking for basketball playing tips on this sub lol.

I'll humor you though. Every athlete is different and style of play has so much to do with size, skillset, coordination, comfort and who you play against. In general, it's a very good idea to have a low center of gravity and when you stay low you can achieve this while also being able to create the most explosive strides you can when gathering to jump or move forward. It also allows for quicker steps and my favorite part, the vision to set up your feet and body in angles that make the defender helpless when you are attacking them. That being said......it's really up to what makes you comfortable and what works for you. A lot of people develop their basketball games based on their childhood and how they had to adjust their game to beat older bigger opponents. This is what developed my floater, my tendency to use foot work to beat my opponents mentally rather than by being faster or bigger and it forced me to have a super fast release because otherwise I would get blocked all the time. Different NBA players have quirks that they developed over the years that make their game unique and effective but they wouldn't work for everyone and just because it does for them doesn't mwan you should copy them. Practice your driving and see what leads to the most effective style. Don't worry about doing it a certain way but instead worry about doing it effectively. || Grew up playing with half of the LA And 1 squad and with classmates that made it to the NBA, I understand exactly what you mean as I get very low on my drives. Even now into my 40’s, I still lower my upper body to angle and squeeze by and through defenders. That said, what I’ve noticed is players that are able to drive with a somewhat upright torso have unusually powerful legs and footwork that allow for that positioning. 

Curry has some of the strongest lower leg strength off any guard in the league. I remember hearing stories on how he used to regularly squat more than most his team. Shai is similar, i have a friend that works with NBA athletes during offseason in LA. He mentioned that Shai’s lower body is one of the strongest in the league for guards. One last point that you should keep in mind as well is quickness and conditioning, when you have more speed and conditioning than the player guarding you, its much easier for you to “blow past” players with the need to angle upper body. || D-Wade, Jordan and A.I were masters of getting low - SGA is a tad slower than them but he’s able to replicate that skill really well. A lot of videos of Jordan driving you’ll see his shoulders at the level of the defenders’ knees. || Haha no. You need to get low, most everyone else needs to, he doesnt.

He has the combination of speed, quickness, size, strength, shiftiness to not have to against certain defenders. || It depends on the guy, I think. For some guys it's more fluid and natural and they can get enough explosion but for power guys, I think it's still important to get low in order to get through contact. Guys like Steph, Halliburton and SGA rely a lot more on deception than power so it's fine for them. || An underrate part of this convo is reffing and foot speed. Getting low usually means driving with intent to dip your shoulder past the opponent so they have to go through you to reach the ball. Now imagine your 6'6"" and have refs that call everything, by going high you increase the chance of contact because you literally want to attack the defenders arms since if he touches you, foul. You're not getting that call at lower levels or req league. Think of Harden who looooves hanging that ball up high on a drive explicitly to get contact. The worst thing is reaching the rim and the ball is low because now you have to bring it up through the trees. Instead think of a Giannis or LeBron or Harden, they keep it high so when they reach rim, they don't have to bring it back up. If your handles are worse then you keep it lower to keep it out of reach. || The biggest thing is that Shai has a 6’11” wingspan. He doesn’t have to get low to keep the ball and that is the intent getting low is ball protection. If you can keep the ball low while losing none of your court vision that makes you unique and in his case the best PG in the NBA || Dude what are you talking about?

Defenders don't need to worry about Shai shooting because he's a low volume shooter??? 

Dude is shooting 55/45/90, literally a historically great shooting season.

You absolutely have to respect his shot, that's why he can get away with it.

You already had the answer. || The best dribblers are fake artists. And to fake the opponent everything is important, the position of your body as well. He must never know what are you doing next. || Kyrie and Rose rely more on changing direction to avoid contact whereas Shai can drive with just a little bit of direction advantage, take contact in a fairly upright position, and it doesn't faze him much at all as he brings the ball back for a midrange. Both of them get low when they really want to change direction quickly (left/ right) because the knee stance require them to for acceleration.

Also Shai has a long ass wingspan which probably affects how he dribbles. Don't need to get as low for the ball to not have so much air before it gets back to the hand. || i think the big thing is that he's not really trying to ""win"" the contact, just get you off balance enough to not contest his crazy accurate fadeaway.

most of the time you're trying to go through your defender and stay on balance yourself, but shai is fine getting knocked back because that's where he thrives || SGA’s ability to play “herky-jerky” is totally underrated. Great observation || Interesting observation.  I made a similar observation watching Jared Vanderbilt play defense against the Knicks the other week.  Somehow he is able to slide and stay in front easily while staying upright.  These guys might just be freaks among freaks || Sga is 6’6, he has long strides. The main thing with him is his change of speed and his physicality. || I’ll try to add videos tomorrow, you’re right videos will make it much easier for everyone || Kyrie and Rose rely more on changing direction to avoid contact whereas Shai can drive with just a little bit of direction advantage, take contact in a fairly upright position, and it doesn't faze him much at all as he brings the ball back for a midrange. They all get low when they really want to change direction quickly (for maximum left/ right separation) because the knee stance require them to for acceleration.

Also Shai has a long ass wingspan which probably affects how he dribbles. Don't need to get as low for the ball to not have so much air before it gets back to the hand. Look at Jamal Crawford's clinical dribbling crossovers.

As for Steph, OP is basically right. He will maintain upright position for threat of shooting. It's rare that he gets low because half the time he isn't accelerating or changing direction much. || Being a 6’6” guard who the defense cant speed up , gives you certain luxuries most of us dont have",0.116,0.608,0.276,0.4404,0.07,0.814,0.117,0.7893,0.097,0.771,0.132,0.9978
