player_name_canonical,search_query_used,game_date_reference,subreddit,post_id,post_title,post_body,post_score,post_num_comments_total,comments_scraped_count,post_url,post_created_utc,scraped_comments_sample,title_neg,title_neu,title_pos,title_compound,body_neg,body_neu,body_pos,body_compound,comments_neg,comments_neu,comments_pos,comments_compound
Shai Gilgeous-Alexander,"""Shai Gilgeous-Alexander"" OR ""Shai"" OR ""Gilgeous-Alexander"" OR ""The Shai""",2025-03-09,nbadiscussion,1j859il,The One Rule To Save The NBA,"The NBA is in the golden era of skill, athleticism and creativity. It's also in the golden era of another highly valued tactic used by players... Foul grifting.

**Full Disclosure:**

*Before I discuss this topic further, I want to be fully transparent: I used to teach players how to grift, and I’m not ashamed of it one bit.*

*The NBA is one of the most competitive environments in the world, and you win in this league on the margins. All players must abide by the same rules, but the more creatively a player can interpret those rules and push them to their limit, the more they will find an edge against their competition.*

*Necessity is the mother of innovation.*

**Au Revoir Paris:**

The discourse surrounding the 24/25 NBA season has included much discussion of how long games *actually* take and multiple takes on wanting the NBA to be more like FIBA.

Mainly because the 2024 Olympic Tournament in Paris delivered a compelling, competitive, and beautiful *basketball* product.

It gave fans a snapshot of what the best players in the world looked like when they were forced to *play* basketball instead of putting together audition tapes for Wipe Out.

FIBA referees showed the world that they do the one thing NBA officials refuse to do:

They do not acquiesce to foul-grifting from the top players.

Players in the NBA will always seek competitive advantages wherever they can; that’s the nature of the beast. The NBA needs a deterrent, something to level the playing field. One rule change will improve the aesthetics and length of games while bringing back ethical hoops, which viewers are clamoring for.

*The Rule:*

*“Grifting Plenty”*

*Any obvious foul-grifting action will result in a foul on the grifting player. Then, the opposing team will be awarded one free throw and the ball.*

This rule is not mild; it’s spicy. But drastic times call for drastic measures.

*(You might be saying this is such a subjective rule; it is, so is almost every other rule in basketball.)*

**Cash Rules Everything:**

During All-Star weekend, the consensus was that the players make so much money that the league will never get them to care about a game in which each player on the winning team receives *only* $125,000.

The risk of an All-Star player getting hurt during the game isn’t as significant as the reward for winning. Everything in basketball is a risk vs. reward calculation, whether it’s playing hard in the All-Star game or attempting to foul grift.

The fine for flopping is $2,000, and it’s not even enforced. The fines for flopping during the 23/24 season totaled $52,000 for the entire league! 

The total for the 24/25 season is a whopping $6,000. 

Last week, when talking to folks around the league about the issue of foul-grifting, one Eastern Conference Executive mentioned that the $2,000 flopping fine is nothing to these guys; it’s a Wednesday bottle of Cab (Cabernet Sauvignon).

Fines and warnings at these levels aren’t cutting it, not in the slightest; this is a competition issue.

A properly executed Foul Grift results in free throws, the highest PPP action in basketball, and fouls on the other team’s best defenders. The payoff for the gifting player is way too big for a silly warning or empty threat of a $2,000 fine to interfere with their grifting mission.

Newton’s third law of physics states, “for every action, there is an equal and opposite reaction.” It’s time for the league to establish an equal and opposite response to the foul-grifting epidemic because, at this moment, the pendulum has swung too far in favor of the grifters.

**Splitting The Baby:**

Over the past week, I’ve watched way too many of the best players in the world being fouled repeatedly. I estimate that I’ve seen about 2,000 fouls committed.

I’ve come away with two conclusions:

1. The best players in the world are creating more advantages than other players. They are the best because they combine size, athleticism, and skill in a way few others can—not because they’re the best at drawing free throws.
2. The best players do not need the extra help of giving them foul calls when they have not created advantages and do not attempt to make basketball plays.

The NBA and its officials' most significant problem is that they’re trying to split the baby. They refuse to take a genuine stand on foul grifting. Instead, they’re choosing the route of half measures.

When officiating these grifting actions, they are fouls for some players but not others. They are shooting fouls sometimes and side-out other times. They are play-on situations for some and fouls other times.

One of these grifting actions could happen precisely the same way four games in a row and be called differently each time. Either these players are interpreting the rules correctly, pushing them to the absolute limits, and creating advantages on the margins, or they’re making non-basketball plays, and the structure needs to be reinforced.

NBA players are some of the world's most creative and competitive people. If you give them a structure to play in by using well-defined rules, they will find a way to push the limits and create a competitive advantage. If you change the structure by changing the rules to something different, they’ll do the same thing again. Players will adjust.

The league has to pick a side and stop trying to split the baby.

The torpedo is another non-shooting foul that is only called because the player makes an unnatural shooting motion.

The torpedo is precisely what it sounds like. It’s when a player launches into the defender and throws their arms up as if that’s how they shoot a shot[5](#footnote-5). The offensive player will almost always put themselves off balance, out of rhythm, and totally out of control, all for the chance at *earning* a trip to the free-throw line.

Few players have the type of heat-seeking precision as Joel Embiid and Shai Gilgeous-Alexander. Some torpedo actions will be called shooting fouls, some non-shooting fouls; no one knows which will be the case.

If Adam Silver and the league office are looking for more of that FIBA/Olympic magic, look no further than foul-grifting. They must set the standard and determine what will and will not be tolerated.

Seeing the players *play* the game and find solutions to a defensive problem is one of the best parts of basketball. Still, too often now, the best players see the most efficient solution as throwing their body into a defender or simply falling. If you can trick an official, the payoff is massive, and there are zero real consequences. After all, it’s easier to make a shot from 15 feet away with no one guarding you than anything else.

Between the grifting and reviews, the game has become a constant stop-and-start debate about the rule book.

Consumers and employees both throw their hands up due to the lack of consistency.

One of the classic flavors of grifting is *The Fall*; it’s not a complicated move, but it takes years of dedication to the craft of grifting to pull it off.

Players will fall when given the opportunity. This sounds pretty wild, but it highlights one of the keys to being a good foul grifter in the NBA: You have to be willing to make things so uncomfortable and awkward for everyone that it forces officials to blow the whistle to bring the situation back into the social norm.

By blowing the whistle for a foul, the officials are telling the 15,000 people in the stands, “Hey guys, don’t worry, this 7-foot, 290-pound adult didn’t just fall out of nowhere; there was a very violent action committed against them; you just couldn’t see it.”

If the NBA wants fans to fall back in love with the product, it must create a structure through the rules to eliminate the competitive advantage of foul-grifting. A genuine deterrent is required to shift the status quo and make ethical hoops not the exception but the norm.

But maybe that’s not what they want; I could be completely off here. Perhaps they want what is happening right now, the engagement. I’m more of a purest who believes the game deserves more, but at the end of the day, maybe it’s all just Baby Faces and Heel turns.",144,56,30,https://www.reddit.com/r/nbadiscussion/comments/1j859il/the_one_rule_to_save_the_nba/,2025-03-10 14:13:38,"The flow of basketball is what attracted me to it 40 years ago. The flow is still there, but as the game tightens up, the grift increases, and the flow decreases. 

I don’t think a monetary penalty is the answer. I think the punishment in real game terms is. 

I think the FIBA rule is the key, but I also loathe giving the refs (SOME of the refs) another opportunity to control the game.

So along with any rule change, I think we desperately need to increase ref accountability. Otherwise we’re going to have endless debates around how refs are changing outcomes. || This isn’t too far from the flopping rule the league tried a few years ago and then just silently stopped calling. Just harsher penalties. 


Since they didn’t stick with the version of this with less penalty, I don’t see them over-correcting opposed to just not calling the foul and then that foul-baiter just wasted a possession. Naturally, they’ll stop doing it without stoppage in play and more whistles in a game intended to have more fluidity. 


Already seen success with the rip through not counting as a shooting foul. No need to penalize when you can just stop rewarding. || Well. The only problem I see here is, that we're trying to fix what isn't necessarily broken. FTA for the past few years is low. Lowest than any other period in league history. 

People perceive it as a problem, because the most common way of commenting on the NBA is complaining. And this is a real problem. We're constantly bombarded with negative opinions about the league. || There are many film edits/clips that add context to the words written above. You can check them out here:

[https://lowmanhelp.substack.com/p/the-one-rule-to-save-the-nba?r=2wmouo](https://lowmanhelp.substack.com/p/the-one-rule-to-save-the-nba?r=2wmouo)

Thanks for reading, and I hope you enjoyed it! || I don’t think you need to punish grifting. Just don’t reward it.  I have t seen many flop calls this year but seen plenty of flops. I’d just be happy with a simple rule change. If the offense purposely bumps into the defense. No foul. || This is one of the reasons curry is so damn popular and fun to watch. He rarely grifts. Same goes for Jokic. And I know many will disagree, but LeBron also doesn't foul grift, he just embellishes contact when there is some. The most fun to watch players don't foul grift. || You'd have to stop and review the stupid flop if there's a free throw for the other team. I like where your head's at but you've just got to make the fines incredibly harsh: $100k fines and you're suspended for two games for the first 5 flops, second 5 flops you get 5 games/$250k, and if you rack up 5 more you're ineligible for individual awards and the first round of the playoffs. || [NBA individual seasons ranked by FTA](https://www.basketball-reference.com/leaders/fta_season.html)

James Harden has a few seasons in the top 50, Westbrook has one, KD has one. Everyone else in the top 50 is retired || Paris showed us how great the game is with the international rules for timeouts at the end of the game. Watching them just ball out that last two minutes was the best difference. Fouls didn’t register. || I like trying to get rid of grifting but what do you do when Dame curls off a screen pulls up to shoot and the defender's arm is curled around his arm? That's a foul but everyone considers it grifting.

He used to get continuation and free throws but the refs have stopped giving that. But now you want to call a foul on him for curling off a screen and shooting... || The answer to this problem is simple, but goes against the league’s officiating philosophy. The answer is the referees should just… not call these as as fouls, totally based on their judgment that it is foul seeking behavior. Stare at it and don’t blow the whistle.

The NBA has a legalistic philosophy that officiating can be totally enumerated by specific hard rules and there should be no subjectivity. Hence it is fundamentally exploitable. There will always be loopholes and the league lets you exploit them.

But in FIBA the refs are just like “Nah. I’m in charge of this game and I’m not going to call that nonsense as a foul and you’re making yourself look like an idiot because now it’s a turnover”

The NBA needs that.

If the league just tells officials - don’t call fouls on plays where the offensive player is looking for it; and you can make that judgment as you see fit. Foul grifting would go away and the game would be better to watch. 

And yes people would be mad about officiating being too subjective. That’s the trade off. Basically what the premier league does. Improve watchability at the expense of increased subjectivity. || A lot of foul grifting can't be caught during the flow of a game and stopping to review those calls would be terrible. But that shouldn't stop a post-game review. I'd be in favor of awarding technicals after the game for any foul grifting. That wouldn't help teams during the game but technicals could quickly add up, leading to suspensions and fines that might actually deter players. || This whole obsession with “foul grifting” and “ethical basketball” is so fucking stupid. The rules need to change for sure but this is not going to “save the nba”. Players have been “foul grifting” forever, make the games more accessible to watch, hire some actual analysts who take the game seriously, increase physicality, reduce the amount of games in the season.

There’s no “one fix”, there is a lot wrong with the nba at the moment || I feel like if the NBA reduced the personal foul limit from 6 to 3-4, refs would naturally start calling fewer fouls to avoid fouling people out. They'd have to be choosier about the fouls they call and would stop calling tick tack fouls. 

Maybe pilot the program as a regular-season only thing first and see how it goes. Since in the postseason they're allowed to play more physically anyway, and the consequences of a star player fouling out in a 7 game series are massive. || The problem with your rule's logic is this: 

>Any obvious foul-grifting action will result in a foul on the grifting player. Then, the opposing team will be *awarded one free throw* and the ball.

The problem with only giving the opposing team one free throw is that the risk-reward status still benefits the grifting player/team to grift. If you get two free throws for a successful grift, but only one free throw and the ball (which is out of bounds and makes it more likely to steal it) for being caught grifting, then the team still gains something by grifting in ""you only give up one point instead of two or possibly three/four.""

The only way an anti-grifting rule will really have legs is if the amount of free throws the opposing team gets is equal to the amount of free throws the grifting team would have gotten if the foul was called. If the foul for grifting is now two FT's and the ball, now you have a real punishment for the team instead of ""a foul for your good defender that's part of the game, you take a point or two away from the opposing team they should have gotten, and you have a better chance at stealing."" || How about banning habitual foul grifters from being in MVP and all-NBA conversations?

Then maybe Embiid and Shai would spend less time launching their bodies into opponents when taking a shot || Something I think about all the time is how players are coached young to look for contact when they drive to the rim. I always saw that as a direct pipeline to foul grifting and baiting. I also want to point out the difference between flopping and baiting as I think it’s another reason this problem isn’t the easiest to solve with one rule. 

Flopping is pretending to be fouled or exaggerating when you are fouled to get the call. Soft fouls are real but certain larger stronger players don’t get the calls. This leads to flopping. James harden for all his baiting was the first I would see cock is head back to get the whistle for slaps to his arms that of course were harder to see. 

Baiting is when you purposefully try to get the defender to foul you almost foregoing the basket. Sticking with harden this was what I think people hated the most. And we have seen the league do things to get around this right? Like the arm tie up and throwing the ball up to nowhere basically then getting 3 free throws. That obviously sucked and I think we don’t see it anymore. Or at least I haven’t seen it. 

All this to say I think as others have said the foul problem with the league is overstated. I think the biggest thing hurting viewership is the inability for people to watch the games, the games being constantly late. And the way the nba seems invested in shitting on its product.

However to specifically address your rule suggestion I just think these guys are too good. The foul baiting and grifting will continue unless technology changes because no matter what there will be missed calls. Like the shove against Luka a few nights ago etc. that will make these guys think they have to do this, it’s their right to do this to win games. Like I feel like one missed call begets 20 flops. The refs have a hard time making close calls now, imagine when your team loses a game because the ref said your star player flopped in the last 2 minutes. I just feel like the nba would never do this. || > Any obvious foul-grifting action will result in a foul on the grifting player. Then, the opposing team will be awarded one free throw and the ball.

All they have to do is *stop calling them on the defender*. No need to call it on the offensive player (unless it's an offensive foul for other reasons).

As long as these same refs have a mindset that these ""grifts"" are somehow defensive fouls, telling them that grifting is an offensive foul won't help - because obviously the refs see them as legitimate fouls and not grifts in the first place! || Let Nico Harrison make trades for all the teams, just for pure entertainment.  Although it's likely the Lakers end up with SGA, Giannis and Jokic. || [removed] || It seems like the OP has a lot of intelligently reasoned posts, but I agree its not clear that foul baiting is really a major problem in the NBA beyond a few highly vocal SGA haters (and notice he's more than 1 FTA per game behind Giannis).  The last time someone led the league with fewer FTA per game was Harden in 2017-2018. || Yeah but take into consideration how much the league changed in relation to shooting. We are historically shooting the most 3s which gives less chances to be fouled and foul baiting while driving is even more noticeable because of it. There are extended periods of time in todays NBA, where a player either shoots or drives and looks for contact. On drives is easily awarded with FTs (ofc this depends on officiating which op rightfully deems as another problem which is consistency of whistles). For a fan it can quickly become boring. || I do not understand how people think FTA is a good argument. Defenders are having to change the way they are defending because of the foul-grifting behavior of offensive players. || FTA is low because no one is driving to the hoop and trying to yam it. || Can you state the one rule to save the NBA in one sentence? || Even if it's not called a few times, it doesn't stop the players from trying because the reward of getting one is too great and there is no downside to being caught. || I've gotta disagree. The players are the ones who need to own their bullshit and stop it, but if they won't, there needs to be a harsh penalty. For example: 

* 2 shots against and loss of possession. 
* Technical foul every time. Standard 2 techs and you're done for the day. 
* Fine first time, then suspension for every occasion after that, increasing with what occasion it is.

I don't know what the answer is, but I don't entirely agree it's on the referees to get this right - the game is so fast, this is a huge ask. || I mean there is embellishing and there is flopping. Case in point the Celtics game and Tatum. || You have to nip it in the bud in real time. The money would be a good idea in theory, but does that mean the flops are legislated after the fact? If so, then it still leads to a competitive advantage in real time. 

The fines come out of their checks, they don't write checks. 

If every two weeks you were paid 1.375 million (33 million per year), would you really notice if the check was a little lighter once every few months? || I don't believe that is the type of example I'm citing here. Here's a link to the cited film to give you a better look. 

https://open.substack.com/pub/lowmanhelp/p/the-one-rule-to-save-the-nba?r=2wmouo&utm_medium=ios",0.0,0.652,0.348,0.4939,0.054,0.775,0.171,0.9996,0.125,0.75,0.124,0.5248
