player_name_canonical,search_query_used,game_date_reference,subreddit,post_id,post_title,post_body,post_score,post_num_comments_total,comments_scraped_count,post_url,post_created_utc,scraped_comments_sample,title_neg,title_neu,title_pos,title_compound,body_neg,body_neu,body_pos,body_compound,comments_neg,comments_neu,comments_pos,comments_compound
Shai Gilgeous-Alexander,"""Shai Gilgeous-Alexander"" OR ""Shai"" OR ""Gilgeous-Alexander"" OR ""The Shai""",2024-12-14,nbadiscussion,1hetyi2,"Cade Cunningham is a star. To become a superstar, he has to fix two problems","Cade Cunningham is having a moment. But how high can he soar with two distinct weights dragging him back down to Earth?

In his fourth season (and first with a dedicated, competent NBA coach in JB Bickerstaff), the 6’6” point guard is putting up All-Star numbers: 23.6 points, 9.3 assists (third in the NBA!), and 7.3 rebounds per game on 45% shooting from the field. He’s also canning 38% of his 6.3 three-balls per game.

Cunningham’s most notable improvement is in his shot. The three-pointer was a major question mark for Cade coming into the year, but he’s shooting a career-high on both accuracy and volume, and it’s become a legitimate weapon. Importantly, the improvement has come across the board and supported a shift in how the shots are generated.

He's improved his catch-and-shoot accuracy from 37.1% last year to 42.0% this year and his pull-up three-pointer from 32.5% to 36.0%. However, his volume of catch-and-shoots has decreased from 3.4 to 2.3 per game, and his volume of pull-ups has doubled from 2.0 to 4.0

This is unusual! We often hear that coaches want star guards to take more catch-and-shoots because, for most players (including Cunningham), that’s the more efficient shot. The gravity of a team’s biggest star moving off-ball can free things up for lesser heavenly bodies, too. But Cunningham is doing far more self-made magic off the dribble than before and converting it at a very respectable rate.

In fact, that’s an overall trend in Motown: the Pistons are quickly resembling the kind of heliocentric offenses that have started to fall out of favor.

Everything flows through Cunningham. He is fourth in the league with[ 94.0 touches per gam](https://www.nba.com/stats/players/touches?dir=D&sort=TOUCHES)e, more than LaMelo Ball, Giannis Antetokounmpo, or Luka Doncic. He’s [sixth in passes per game](https://www.nba.com/stats/players/passing?dir=D&sort=PASSES_MADE), and his [34.9% usage rate](https://cleaningtheglass.com/stats/player/4864#tab-offensive_overview) is fifth behind only Ball, Giannis, Ja Morant, and Shai Gilgeous-Alexander.

Despite the gaudy assist totals, I’m not sure Cunningham’s passing has improved so much as the team’s offensive personnel has (it must be nice to play with some veterans like Malik Beasley who are capable of making the occasional shot, although the team’s shooting is still lackluster overall). Dishing remains Cunningham’s best attribute. He has especially nice vision finding alleys for oops: \[[video here](https://www.basketballpoetry.com/p/cade-cunningham-is-a-star-to-become)\]

Cunningham is attacking the boards with a renewed vigor this season (personal aside: I love rebounding guards), and his defensive effort has dramatically improved from last season’s career-worst level. Coach Bickerstaff has always gotten the best from his players on that end, and Cunningham is no exception. He’s had some loud blocks, both of the chase-down variety and as the low-man help defender. This one on Antetokounmpo (followed by a sexy long-range bounce pass) deserved a comic-book-style “POW!”: \[[video here](https://www.basketballpoetry.com/p/cade-cunningham-is-a-star-to-become)\]

Bickerstaff hasn’t shied away from siccing Cunningham on talented ballhandlers, either. He’s been the primary defender on Jaylen Brown and Jalen Brunson, for two notable examples. While defensive tracking data is suspect at best, opponents have shot [4.2% worse than expected](https://www.nba.com/stats/players/defense-dash-overall?CF=PLAYER_NAME*E*cun) with Cunningham as the nearest defender (in the same neighborhood as Dillon Brooks, Draymond Green, and Evan Mobley, although I’m certainly not suggesting he’s on their level as a defender).

At this point, Cunningham is a bit too slow and inconsistent to be more than an average defender, but average is fine! He’s rarely the weak point offenses will attack — [teams have only targeted him 13 times in isolation](https://apps.synergysports.com/basketball/players/615e4bcfe771e94fc0e9eab4/playtypes?seasonId=66ec94cbd172189f95bf08b2&competitionId=non-exhibition-54457dce300969b132fcfb34&compsCategory=1&offense=false), far less on a per-game basis than last year. They prefer to go after juicier targets like Tim Hardaway Jr. or Tobias Harris (although Harris, in particular, has held up well in those situations). It is worth noting that Bickerstaff’s players have historically shown steady defensive growth across multiple seasons. Cunningham’s size and intelligence mean he could end up being a plus on that end.

Add it all up, and he’s carrying a two-ton made-in-Detroit SUV on his shoulders. It’s a heavy load for a fourth-year player, particularly one still with fewer than two full seasons of games under his belt. To Cunningham’s immense credit, he’s grown with his burden. His advanced metrics are at career-best levels, including an [EPM ](https://dunksandthrees.com/player/1630595)just outside the top decile of the league. [Andy Bailey’s Huge Nerd Index](https://x.com/AndrewDBailey/status/1866908831525290265), which averages seven prominent catch-all metrics, rates him as the 30th-best player in the league. Having turned 23 the day before Halloween, Cunningham is younger than every single player above him except two (albeit by a few weeks in some cases).

This is all fantastic news for the Detroit Pistons. They have a young, growing star on their hands. But to become a *superduperstar*, Cunningham has two last warts to freeze off. Both require a little context.

Everyone’s heard about Cunningham’s turnover problems at this point. He leads the league with 4.6 per game, a smidge higher than Young or Ball. Part of that is due to the sheer amount of playmaking that falls on the youngster. His actual [turnover rate of 15.6% ](https://cleaningtheglass.com/stats/player/4864#tab-offensive_overview)is only 33rd percentile for point guards; in other words, below-average but far from league-worst.

My eyeballs see two major causes. First, he has to tighten up his handle. Cunningham’s ballhandling skill is high, but he can get careless with the rock. A low point was a recent game against the Pacers (an easy Detroit win, to be fair), when Jarace Walker snatched Cade’s cookies four separate times. He starts his crossover high and pushes through it slowly, giving good defenders time to jam him up: \[[video here](https://www.basketballpoetry.com/p/cade-cunningham-is-a-star-to-become)\]

Cunningham also routinely makes passes my toddler would call “silly” (and I’d call something else). At times, he predetermines his reads and can’t or won’t audible. His [8.3% turnover rate on drives](https://www.nba.com/stats/players/drives?CF=GP*GE*10&dir=D&sort=DRIVES) is the highest of anyone in the top 20 for drives per game (min. 10 games played), and inexplicable passes like this are part of the reason why: \[[video here](https://www.basketballpoetry.com/p/cade-cunningham-is-a-star-to-become)\]

Other times, he gets caught indecisively in the air, lofting balloons for opponents to snag by the string and merrily sprint away with: \[[video here](https://www.basketballpoetry.com/p/cade-cunningham-is-a-star-to-become)\]

Cunningham should outgrow some of these mistakes, but like any high-usage ballhandler, some will always remain. Turnovers, in and of themselves, aren’t always a bad thing, but I’d like to see more turnovers of aggression rather than meekness. He needs to excise the worst offenses to maximize his playmaking abilities. I am optimistic he will do so, particularly as the Pistons’ surrounding cast improves.

Cade’s second flaw is a little more nuanced. He’s struggled to finish at the hoop his entire career, and it hasn’t improved much over time. A third of his shots have come at the rack this season, a substantial number, but Cunningham [has never finished a season above 58% at the rim](https://cleaningtheglass.com/stats/player/4864#tab-shooting_accuracy), an atrocious rate for a player his size.

A deeper statistical analysis reveals something interesting. Bball-Index’s proprietary formulas say Cunningham has elite finishing talent but is taking some of the hardest shots in the league when considering shot location and defensive presence (he is in the first percentile for “Rim Shot Quality”).

That’s a double-edged sword. On the one hand, it means Cade can generate and finish the difficult shots that all offenses require to a degree; on the other, it means he pretty much *only* takes difficult shots. Cade is a below-average athlete for someone who drives as much as he does, relying on craft and guile to worm into the paint. I’m not sure I’ve ever seen Cunningham redline his engine. The ability to play at his own pace is a skill, but he also never gets the blow-by layups that quicker counterparts can feast on.

He doesn’t have enough first-step quickness to explode past guys or vertical pop to elevate in traffic for big finishes (Cunningham has tallied just four dunks in 22 games this season). He is at his best when he remembers to use his size to bump a defender off their lane and extend over them for a layup. He loves to use a spin (full or half) to get a moment’s separation: [\[video here](https://www.basketballpoetry.com/p/cade-cunningham-is-a-star-to-become)\]

Taller, slower point guards rarely excel in the paint; LaMelo and Lonzo Ball have famously struggled with the same issue. Cunningham isn’t likely to turn into the Roadrunner anytime soon, but there are ways for him to improve.

Can he get even stronger and bully smaller defenders? Cade doesn’t have a bulldog frame, but there is potential for him to fill out more. Can his three-point accuracy improve to the point that defenders have to stick tighter to him, allowing him to create bigger advantages with hesitations and shot fakes? Can he develop Shai Gilgeous-Alexander’s airtight shake-and-bake handle? He’s been on-ball more than ever this year, but is there some latent cutting and off-ball savvy in his game? Cunningham’s also still working on his off-hand; he’s become *far* better driving left, but there’s still room for improvement.

A related note: finding a way to draw more free throws would help Cunningham’s efficiency immensely. Some fans believe he gets a bad whistle, but the truth is that he hasn’t been able to create off-the-dribble advantages that lead to compromised defenders. They have no reason to foul when they can bother the shot with a good contest.

Taking a step back, the fact that Cunningham can get to the rim as much as he does is promising; adding just a little more efficiency here would do wonders for his overall game. He’ll have to hit on at least one of the ideas above to do so.

The difference between stars and superstars is their ability to create high-level, efficient offense for themselves and their teammates. Cunningham has continually progressed in this area, and lineups with the point guard [have scored at league-median rates](https://cleaningtheglass.com/stats/player/4864/lineups#tab-four_factors) despite below-average surrounding talent. But there isn’t a superstar in the league with as poor finishing numbers as Cunningham (at least, who doesn’t also draw free throws), and he simply must find a way to improve his rim scoring to reach his potential.

Cunningham has developed (and brought Detroit along with him) despite one of the worst basketball ecosystems in the league. For the first time since Cunningham was still in high school, the Pistons are respectably bad instead of a laughingstock (their *best* record in the last five years was 23-59; they’re on pace for 32 this season). Questions about Cunningham’s ceiling on a contender are beside the point; Cunningham is far from a finished product, and the Pistons have a lot of talent acquisition to go before they can start worrying about competing for home-court advantage in the playoffs. Cunningham has time and a clear roadmap for improvement. There are multiple routes he can travel to get to his destination, although he’s far from certain to get there. I’m excited to see which direction he takes.",304,48,30,https://www.reddit.com/r/nbadiscussion/comments/1hetyi2/cade_cunningham_is_a_star_to_become_a_superstar/,2024-12-15 09:43:39," I want the kid to succeed. Detroit has been no-man’s land for almost twenty years in the NBA. Hope he can continue to get better. His scoring needs to improve overall if he’s going to make it to elite levels. At that level of usage he needs to be scoring more. Some talent around him would help that but he’s just not that dynamic of a scorer compared to other elite guards. At his size he should be able to score more effectively. || Great read! It's been a while since we've had this much excitement in Detroit basketball. Can't wait to see how he continues to develop! || [removed] || Thanks for reading! As always, I've collected a half-dozen illustrative video clips that I think add a lot to the experience. You can [view them all in one place in-context here.](https://www.basketballpoetry.com/p/cade-cunningham-is-a-star-to-become)

As someone with a surprising number of connections to Detroit, I'm glad the Pistons are finally a decent watch again. It's been a long time coming! || Sorry to be a pessimist, but I don't see anything here more promising than good stats on high usage on a bad team.  3rd in assists per game is less impressive after factoring in his high usage and turnover rate.  His improved scoring total is less impressive after factoring in that he's still at -5 TS+. || Great read! I’m a huge Cade fan especially now that’s I’m watching him drop double doubles on the regular. Which secondary offensive piece do you think they need to develop so that Cade doesn’t have to take 25 shots a night? || Cade doesn't have the capacity to become a superstar. My definition of a superstar:

 -People who don't follow basketball at all know your name.

Or

-Put together a couple of MVP worthy seasons.

Or

-Carry a bad team in the playoffs on their own.

I don't think he can do any of those things but who knows. || True superstars just pass an eye test. They create moments, in a flurry, and in more than one or five or ten games. It's not even about reducing flaws, although that helps. It's about being must see tv. || [removed] || cade gets hacked at the rim every single game. defenders almost know they can get away with it bc it’s detroit and cade and refs don’t give a shit about us || Its really funny how people were literally saying he was a bust and writing him off when he got hurt…and now he’s a bonafide “star” with superstar potential lol. We really swing wildly || Appreciate the indepth breakdown! I didn't realize he was shooting so well this season. Hopefully it's sustainable || Great post, but strangely this is the 2nd long post in a row I've read where ""Audible"" was used in place or ""Adjustment"". Completely unimportant, but a strange coincidence || [removed] || What it comes down to with Cade is the scoring efficiency. As is, Cade taking a shot is well below average offense, which is not really acceptable for a first option. Usually if a guy is going to take that leap to superstardom we would have seen a season of that level of production by year 4 as well.

I do think he’s improved quite a bit this year, but he’s more gone from top 200 player top top 80 player. But I wouldn’t bet on him ever being a top 15 player at this point || I was about to say minus the 8yr run or so of Billups & co. But thats been nearly 20yrs… Damn time flies || Yep. There are clear ways for him to get better around the rim, like I outlined, but it will be difficult for him to become elite. He's still so young in terms of raw age and game experience, though, so he's got a chance to figure it out. || Thanks, and totally agree! I've got a lot of ties to the Detroit area, so it's nice to see my Pistons fan friends finally getting pumped about the team again. || agreed. I think he has a super flexible skill set that would let him play with any number of stars, but a big forward with shooting/playmaking chops would of course be ideal (although how many of those guys are there?) || We removed your comment for being low effort. If you edit it and explain your thought process more, we'll restore it. Thanks! || It's a reasonable view, albeit one I disagree with. I don't think it's likely he's ever a top-five guy or anything, but his ceiling is All-NBA. I really think it's hard to overstate how damaging starting his career under two coaches who didn't have the passion for coaching anymore was, so I don't want to dismiss the idea that he can make dramatic improvements with competent leadership (and better teammates). || To me Cade is 100% THE example of eye test needed because stats don’t tell even half the story. Until you have seen 100’s of his passes fly out of bounds bc the wing didn’t slide or a player just doesn’t catch the ball, it’s so hard to judge his ceiling. And that’s just one tiny example.

Jerami Grant, Bogey, Olynyk…Best players he’s played beside, and none overlapped. Wild.  || Out of the top 70 players according to VORP, only Fred VanVleet has a lower TS% than Cunningham.

The Pistons are 8-4 when Cunningham takes less than 20 shots in a game. They are 1-9 when he takes 20+ shots.

Detroit is better when Cunningham isn't shooting. || I think this is mostly because the team around him is so bad. They don't really have another creator, so he gotta do it all by himself. They should get some talent around him. || Truthfully I’m not sure the answer is on the roster yet. Not a big believer in Ivey as that kind of guy. || [removed] || Maybe! I am sympathetic to the discussion that superstardom is about fame more than play, although the two are obviously tightly intertwined. We’ll see if Cade can provide those moments as the team improves || We removed your comment for being low effort. If you edit it and explain your thought process more, we'll restore it. Thanks! || Hopefully, and thanks for reading! || Could be, but hopefully this year is an inflection point towards relevancy again.",0.184,0.816,0.0,-0.4019,0.067,0.756,0.177,0.9997,0.066,0.724,0.21,0.9996
