Post Title,Post Body,Comments,Date
[All-Access] Stephen Curry making a fan's day by signing jersey at NBA Store NYC,,"That kid has more manners than a lot of adults || “Mr Curry” 
   
that shits adorable || Meeting a player like Steph as a kid might have given me a heart attack. I met Mario Elie when he signed with the Spurs and I instantly folded. I barely even knew who he was because I was 9 years old, and I still couldn't even talk. My family still makes fun of me for it. || Thats a core memory for sure || [removed] || ""That's like the best point guard of all time man""

👂 👀🤝 || I'm gonna say it made his month, at least. || MJ would've told the kid to beat it || being on the receiving end of star-struckness must be so bizarre. people unironically mouth agape just beholding you lmao

steph is a class act though, so inspirational man || look at Curry man. So inspirational






No, but really. This kid has good manners and was admiring from afar until Steph noticed and greeted him. A lot of grown adults would be bum rushing Steph putting their camera in his face asking him to sign something. || This little redditor dissing Magic || Little bro been raised right, you can tell. || Steph is a class act compared to some of the others in the league.  He along with his wife do some pretty amazing stuff.  Lucky kid! || Fuck that’s so cool. 

Along with being the greatest shooter of all time he’s also a fucking amazing person and teammate. || That kid will have a lot to talk with his friends and many people. || His face in the beginning is so great. And then when he realizes his mouth is just hanging open, he’s like “Alright I gotta keep it together but I physically can’t close my mouth…i’ll just cover it with my hands.” Lol that kid is awesome. || surprisingly small crowd or maybe they limited entrants || I could barely think straight just seeing Steph on the court for the first time live after 10 years on TV, didn’t feel real or possible. He proceeded to break his 3 pointers made streak and score 5 points I think. || Add this to the happy kids getting autographs Hall of Fame, [along with the Mike Trout kid](https://youtu.be/XN8zVfSwRHE?si=ByQRn3e3xb0PIFwg) || In 20 years, this kid will be on the internet defending his GOAT against the next great PG. lol",2024-09-04
"Stephen Curry offers some words of advice to Trae Young: “I told him after the game that it would all come back to him if he continues to approach the game the right way: play with joy, don’t let it build any type of resentment just because he’s not acknowledged.“",,"Steph ""Joy Boy"" Curry || I just can’t imagine being as good as he is and not a nod … that would be hurtful so I can’t imagine the amount of willpower and mental strength it takes to just be ABOVE that. || [deleted] || Good life advice in general.   That being said, it’s a lot easier to play with joy when you’ve already gotten your flowers.  Trae is always under scrutiny for his play-style and his team record. || Politics in the NBA are crazy, maybe the only sport where being a likable guy holds more weight than actual play || [deleted] || how can you actually hate this dude || I love Steph Curry || I’m old enough to remember the same thing happening with Dame when he was starting to break out, snub after snub. Now he’s an 8x all-star. Trae is too good, ik it sucks now but he’ll end his career with multiple all star selections to the point where we’ll forget about these snubs  || [removed] || It’s deeper than just all star games too. Trae didn’t even get invited to the FIBA team. I respect Steph for being candid about this || Trae’s numbers are insane vs the accolades he has. He should honestly have been an all star every season after his rookie year, with those stat lines. || If only the world were more process oriented instead of goal oriented all the time. || What if there's another guy in NBA who plays with joy and no resentment, which of the two will be given the All-Star then. || I wish my concept of not being acknowledged was Stephen Curry complimenting me in national media || One reason it's impossible to root against Steph is how pleasant and positive he always seems. Don't much like his coach or his teammates, but I've always enjoyed Steph || Trae has been one of my favorite players ever since that shoulder shimmy 3 against the sixers. He deserves better than how he's treated. || I mean, after curry’s first snub he hasn’t missed it since. Trae has made it before and then been snubbed twice since, which is way more disrespectful than pre-MVP curry missing it one time || Trae’s been doing that. || Steph always looks like he's having a great time. This is good advice for the kids.",2024-02-04
Top selling jerseys of the 2023-24 season: 1) Stephen Curry 2) LeBron James 3) Jayson Tatum 4) Victor Wembanyama 5) Giannis Antetekounmpo 6) Luka Doncic 7) Devin Booker 8) Kevin Durant 9) Damian Lillard 10) Tyrese Maxey 11) Ja Morant 12) Joel Embiid 13) Nikola Jokic 14) Lamelo Ball 15) Jalen Brunson,,"Pretty wild that the 2 most recent MVPs don't even make the top 10. || I’m surprised Book is ahead of Durant honestly. || This is only because fanatics refused to keep Caruso jerseys in stock || maxey top 10 is pretty dope || Surprised Jalen Brunson isn't higher since he is the hottest NY sports star since Melo. || No one talking about how Lamelo is on here despite missing most the season and being on one of the most irrelevant franchises? Get this man to LA or Miami or something and he’d be top 5 easy || Victor is so obviously the next face of the league, idk why the media randomly lost their minds for a month obsessing over it.  || I am so happy Wemby has met and somewhat exceeded his expectations. Hope he has good health throughout his career too. || Is this globally or just the US? || Curry at 1 surprises me, especially with the Warriors just being bad. At least with LeBron you’ve got him changing teams. 

Also says a lot about LaMelo’s marketability. He’s just plainly popular. Same with Morant who basically didnt play all year and got caught up in a ton of controversies but still outsold the last two MVPs. || Edwards would be up there if they sold the classics. No one I know has ever wanted the current branding, though. || People will blame the NBA as the man shows more passion for his horses then the game || They didn’t include the number of herb jones jerseys because they knew it would hurt the all stars feelings to see him at #1 || Curry has been with the same team his whole career and is still the top selling jersey. Crazy || I’m actually shocked Shai is not more popular nationwide. || [deleted] || That’s wild considering warriors not make playoffs. Maybe get Stephen Curry some help? || Every single one of Jokic jerseys was sold to somebody in Denver or Serbia.  Maybe the most poorly marketed star in NBA history || Wow Wemby || I've got my Wembanyama jersey #gsg",2024-04-20
Stephen Curry and James Harden embrace lovingly.,,"The guy in the black shirt thought that Harden was gonna give him lots of love lmao || Same draft class both great players, they define the best backcourt for last decade


Edit: Thanks for the upvotes. Now can we get a new flair for my LA Clippers? The new logo is super in my opinion. Howdy, mods? || In another world, Harden joins the Warriors and KD is ringless. || Both in their primes would have been a INSANE backcourt. They always played well together every allstar game they were in. || Steph is a legit 6’3” || Just like [old times](https://imgur.com/DT8CRPi)!! 😂 || r/nbaww || I was 16 watching Harden and Curry go back and forth play off series after play off series. I blinked and I'm 25 and Hardens on his 4th team and Curry graduated from splash brother to splash father. I got lock the fuck in life I'm going to be a decade older and nowhere further if I don't. || Now kiss || I remember when these two had that one Foot Locker commercial after they both had their breakout season in 2012-13.

Time flies man. || In another life Harden has the better career || That title. Never change, r/nba || We about to have a grrrrreat season 🙏🏾🙏🏾🙏🏾🫂 || Harden Soul pt. 2 ||  It will never happen but Steph on this clips team would be nasty. || Harden could've joined the Warriors before KD did but he chose not to and re-signed with HOU. || Feel so old that most of the guys from their draft class are cooked || I’m loving the slack key guitar they’ve been playing. || That is the power of the game. || If Harden went to the Warriors instead of KD, does he get the ring?",2024-10-05
"[Charania] Golden State Warriors star Stephen Curry has sustained a left peroneal strain and will be re-evaluated on Friday, source tells ESPN.",,"At least it's not a perineal strain. || [deleted] || when he's out, I expect Draymond not to give a fuck as well. || The real test for Draymond starts || *Draymond Green kicking/punching activated!* || Time to test that depth and see if it really is something. We have no true 1 besides Podz so I’m expecting alot of wiggins ball handling and green shifting away from defence to initiate the offense more || “Strain” doesn’t really tell us much without knowing the degree of the strain. First degree strain might be a two week injury. Third degree strain, which is a full tear, could be a 4-6 month injury. || Should be OK after rest and rehab and hopefully he finds a shoe combination with the braces that stabilizes the ankle. Ankle braces can prevent worse injury after you roll your ankle but don't necessarily prevent rolled ankles from actually occurring.

Could've been a midfoot like sprain...there are different degrees of this, funny because I've actually looked up this injury before because of other players who've had it. Different degrees, different places the sprain occurs, etc. make a big difference in recovery timeline, so looks like Steph dodged a bullet, and that's great for him and the Warriors and the league. They're gonna need him on the road trip.

Dubs need to try to just split the home games with the Pels by any way possible if they can, but will be hard with no Steph, Draymond hobbled, Melton out...now Wiggins questionable too. || My light searching says he'll miss 3-5 weeks || [deleted] || Fuck, a perineum strain is brutal. Trust me. || Fortunately for warriors fans we look like the white fuzz on dog doo doo rn so this matchup should be interesting || LeBron and kd the last of their still standing || That shit fucking sucks. When you get tendinitis in that peroneal you can barely walk. Took me like a year and a half to be able to run again || He’ll be back for the Rockets game and he’ll put 50 on us || Is there a parlay on how many games Draymond will be suspended? || UFC fans know all about the peroneal nerve at this point || I’m assuming 4 weeks could be 8 || ༼ つ ◕_◕ ༽つ STEPH TAKE MY PERONEAL ༼ つ ◕_◕ ༽つ || They’re not winning a game without him",2024-10-28
NBA.com's updated MVP Ladder: 1. Nikola Jokic 2. Jayson Tatum 3. Anthony Davis 4. Giannis Antetokounmpo5. Shai Gilgeous-Alexander 6. Stephen Curry 7. Kevin Durant 8. LeBron James 9. Donovan Mitchell 10. De’Aaron Fox,"[Source](https://www.nba.com/news/kia-mvp-ladder-nov-22-2024-edition)

1. Nikola Jokic
2. Jayson Tatum
3. Anthony Davis
4. Giannis Antetokounmpo
5. Shai Gilgeous-Alexander
6. Stephen Curry
7. Kevin Durant
8. LeBron James
9. Donovan Mitchell
10. De’Aaron Fox

Honorable mentions to Jaylen Brown, Anthony Edwards, Luka Dončić, Karl-Anthony Towns, and Victor Wembanyama



Exactly a month since the NBA season tipped-off. Do you have any disagreements?","Bron, steph, and KD being that high at their ages is fucking nuts. || Fox 😱 || what's kept Jokic's candidacy safe-ish is that the nuggets schedule has been spread out thus far

they've played 3 games in the last 10 days

edit: in that same span, the suns have played 7 || Fox should just score 60 every game || Lebron being on there at 40 is crazy lmao || If Tatum finishes second I consider that winning.

Joker just too good || Kyrie over Luka this season || Where is KAT || I need Franz in the honorable mentions || This sub on high alert as Tatum climbs the rankings. || Last week: Durant moves up from 6th to 3rd because his team went 1-2 while he was injured.

This week: Durant drops from 3rd to 7th because his team went 0-4 while he was injured. || Where is Franz || Giannis gotta average 40 a game to break the top 3 lol || Franz deserves at least a shoutout || About time Donovan Mitchell got some love. Kinda curious as to why Mitchell has been left off so many top 10 current player lists. Not saying he's the best in the league right now, but he's the best player on the best team, so that should count for something.

Also surprised Shai is so low, but I'm biased, so ignore that. || The Nuggets looking like absolute ass while Jokic is on paternity leave was enough to keep him at the top lol || I actually hope Tatum elevates and wins it. I’d love to see him prove it and really earn an individual award for himself || ""Jaylen Brown better"" crowd been dead silent since the season started as anticipated. Never change casuals. || Wemby is somehow honorable mention but noone from Cavs or Rockets? So we dont care about team record anymore? We put Wemby evverywhere so he can fulfill his prophecy as the new star? || You don't lose the games that you don't play, eh? ",2024-11-22
"[Highlight] Derrick ""Stephen Curry"" White goes behind the back and beats the shot clock splashing his 7th three for his 25th points of the night (with replay)",,"**Replays/alternate angles**


*I am a bot, and this action was performed automatically. Please [contact the moderators of this subreddit](/message/compose/?to=/r/nba) if you have any questions or concerns.* || He’s so good, he’s so good. || Fate of the universe on the line... I WANT DERRICK || Sheesh losing the hair really unlocked his game || HE'S DONE MIRACLES ON ME || I assume every shot is going in now wtf || Bald cap curry out here || I love Brad Stevens , I love the spurs and I love Jrich for being decent with us || Really like this guy. Great player. || The best player on the Celtics || DWhite is the greatest role player ever, there I said it. || Playoff merchant || You cannot convince me that Derrick White isn't the best player on the Celtics right now || Trying to post the PP buzzer beater but streamable removed it lmao they're haters || Derrick white is your gfs favorite player || shaves his head and all of a sudden becomes the One Punch Man of basketball. || [deleted] || I was only half joking when I said Derrick white is better than Tatum || Bro might be Steph curry || Derrick White stealing Tatum’s team away from him.",2024-05-07
