Post Title,Post Body,Comments,Date
"[Slater] It’s been a layered 5-yr path to this divorce finalizing in the last couple weeks, where among conversations Klay had, league sources said — was a request of Stephen Curry not to exert his significant organizational influence & up the temperature with management to ensure Thompson’s return","[Source](https://www.nytimes.com/athletic/5605834/2024/07/02/klay-thompson-warriors-split/)

&nbsp;

> It’s been a layered five-year path to this divorce, splintering last season, sprouting earlier and finalizing in the last couple weeks, where —among the conversations Thompson had, league sources said — was a request of Stephen Curry not to exert his significant organizational influence and up the temperature with management to ensure Thompson’s return. Curry’s measured voice, even if it altered the outcome, wouldn’t change the genuineness of Joe Lacob and the front office’s true desire to have Thompson back.

&nbsp;

> Controlling owner Joe Lacob led a front-office effort to take a cold, mostly uncommunicative approach to Thompson’s next contract in his three summers of extension eligibility, team sources said, which isn’t separate from their norm. Lacob has done similar in the past with Curry, Kerr, Bob Myers, Andre Iguodala and Green, using dwindling time as a weapon but ultimately paying up (he put a substantial offer on the table for Myers) after a staring contest.

> Thompson operates on his own wavelength. The Warriors’ decision-makers were warned that a drawn-out negotiation into July during this free-agent cycle wouldn’t be met the same way. He wasn’t trying to leverage his way back until the bitter end. 

&nbsp;

> But his decision, as one source put it, became easy when the Warriors kicked him down the summer pecking order.

> There was little communication between Thompson, the Warriors and Thompson’s agent, Greg Lawrence, and ultimately no offer in this cycle. Warriors sources maintained a plan to eventually make a competitive offer in relation to his market once other business was settled. But they never had the chance. Many league sources said Thompson’s decision to depart was unofficially made weeks ago.","love that Perk yesterday was scorching Steph for not using his power on the Klay situation when apparently he was specifically asked by Klay not to do that.  It makes sense.  Klay wanted the Warriors to prove they wanted him for him, not because Steph told them to. || Slater is a wonderful reporter, but he needs an editor lmao. What the hell does the title even mean? Two commas and an em dash later, I have no idea who asked curry to not “up the temperature on management.” || I think I will have a Beefy 5-Layer for lunch today. || With all due respect, with the performances Klay had last year, his Achilles and ACL, and the performance he had vs the Kings, Klay thought he had way more leverage than he really did honestly. || I think I had a stroke reading that title. What is he even trying to say? || I think its perfectly defensible that the warriors were trying to make a big move to add a true #2 guy, and that they'd come back to Klay after they figured out what was viable. || Although klay played really well during his stretch on the bench, it was pretty evident he did not want to come off the bench. Was too prideful to give up his starting spot. 

The tantrums and ripping into the coaches for that decision as mentioned in the article signaled the beginning of the end. || curry deserves to be anointed sainthood for all the bull s\*\*\* he's been dealing with both on and off the court these last couple of years and said not a damn word publicly or even on social media like we see with so many athletes in this day & age || Can anyone explain this in English? || I know everyone is saying this is a hit piece, but I’ve watched a lot of Warriors games over the past 11 years and his attitude these past few years has been pretty awful for a team to deal with, and that’s just from what I know from games/interviews. I know it’s tough to deal with two major injuries back to back but dude has taken no accountability for his play/literally losing them regular season and playoff games. Still sad to see him go, incredible to watch when he’s on || I remember when journalists could write a proper sentence. || This article was painful to read through and understand || Seems like the Warriors essentially had two paths (the ""flexibility"" that dumping Poole for CP3 granted them):

1. Trade CP3. That would mean they'd be over the tax line, so re-signing Klay wouldn't cost them anything but money.

2. Waive CP3. That puts them below the tax line, and re-signing Klay would hinder their ability to add other players (for example, using the NTMLE).

The Warriors were waiting to see how that unfolded before approaching Klay, and Klay (reasonably) didn't like that he was more of an afterthought than a priority. || It's always so overdramatic. It's always the same:

Player want keep playing for same amount or more money. Team no want that || It was a layered five-year path to read that headline too. || This is horribly written || Honestly,

Klay wanted to see if the Dubs wanted him. Steph of course wanted his boy.

Klay was ready to move on. I think it’s best for him. The only one who is staying and of value is Steph in the Dubs eyes. || What is this word salad can someone ELI5 || What the fuck is he saying || Steve Kerr said Klay was ""no maintenance"" earlier. Klay probably felt like the organization has kept going out of it's way to support Draymond and didn't extend a warm hand to him.",2024-07-02
"[MagicJohnson] Congratulations to Stephen Curry on winning his second PBWA Magic Johnson Award... By the way @StephenCurry30, I had fun hanging out with your mom last night at the Sparks home opener!","Magic Johnson 🎉 Congrats Stephen Curry on winning his second PBWA Magic Johnson Award honoring a player and mentions his mom in the passing.


Curry adds another accolade to his long list of accomplishments. Congrats to him 

Link to the Tweet: https://x.com/magicjohnson/status/1791204249910882619?s=46&t=tcdjeZK1IFjxzBNniQf-NQ","Magic Johnson version of a ""yo mama"" joke. They're tamer than most. || Know he didn't mean it like that, but the phrasing is wild || Stephen Curry wins the Magic Johnson Award and Magic Johnson wins the Sonya Curry Award. || [deleted] || Magic outta pocket for that one || Magic a savage || ""Hey Steph, your mom was quite nice last night"" || >By the way @StephenCurry30, I had fun hanging out with your mom last night

Oh hell naw, ai magic Johnson need to chill || Damn, chat gpt got an update || Magic Johnson is the bull || No way MagicGPT is writing this one... he's trying to beat the allegation finally. || Magic Johnson asserting dominance in the GOAT PG debate with this mom joke. || This man one of the funniest people ever || Jesus... || I know it’s not what he meant but I laughed way too hard at the “I hung out with your mom last night!” comment. || ""Say hi to your mother for me"" || Oh hell no || Curry can never catch a break, man lol || This is a Magic all timer || This isn't even funny. Magic broke the bro code",2024-05-16
Anthony Davis after Team USA’s win over Serbia:  “Got two words. Stephen Curry. Joel Embiid.”,"AD said this to reporters after team USA’s comeback win over Serbia, sending them to the gold medal game. Steph, LeBron, and Embiid all had excellent games: “Got two words. Stephen Curry. Joel Embiid.”

Now if that ain’t the most Charles Barkley comment ever lmao https://twitter.com/marcjspears/status/1821650908742066543?s=46&t=Yz2rcBHCRvce95ldv9YOyw","That's 4 words Chuck || Imagining Shaq laughing his ass off to that “WHATCHU SAY CHUCK?” 😭 || For those that don’t know:
https://youtube.com/shorts/dk63L47b2BM?si=K-PtDxAdyFBcNh_C || There's 3 kinds of people, those that understand math, and those that don't. || ""I throw balls far. You want good words? Date a languager."" || MUST SEE TV || Charles Barkley somewhere smiling || great quote imo || thats 4 words AD || Steph Curry and Joel Embiid, must see TV || AD stands for Auburn eDucation || Been waiting for the steph game and we got it || ""I got two words for you. Stephen Curry. Joel Embiid. Paris 2024 Olympics. Thursday. Basketball. Shooting. Passing. Defending. Serbia. Bad. USA. Good."" || I live by two words.  Fuck you.  Pay me. || Kentucky education moment || “Two words isn’t always two words. I’ll explain later.”

- Anthony Davis || Must watch TV || Damn r/NBA having a rough day because of Joel. Gotta love it. || Two words: My balls was hot. || 9 words: Steph Curry, LeBron James, Kevin Durant, and Joel Embiid",2024-08-08
"[Highlight] Every time Stephen Curry hit the ""night night"" celebration on his opposition in his career.",,"**Replays/alternate angles**


*I am a bot, and this action was performed automatically. Please [contact the moderators of this subreddit](/message/compose/?to=/r/nba) if you have any questions or concerns.* || The Boston night-night was the absolute craziest thing. Considering it was for a championship, but also THREE MINUTES+ left in the game! 🤯 || This is going to be very nice to watch when Curry and his jersey are retired, and can no longer hurt me. || his postgame presser he joked that he thought for a second he might've fudged his perfect ""Night night"" streak when Grimes hit the 3 on him on the other end, but they ended up winning the game so he's still perfect whenever he pulls out the celebration || How do you not have the Olympic one? || Surprised is only 4 minutes long lol || This man is a basketball terrorist 😂 || Has he ever lost after doing that? || I love the reaction from the coach on the 4th one (against the rockets) so fucking much || I hate this man, he's so entertaining to watch until you watch the dreaded skyfucking 3 against your team || The night-night has to be the most devastating and awesome celebration. || This is what happens when you've nothing to prove and a lot to be accomplished!!!! When he's done he’ll for sure be in the top 5! 🐐 || This guy is insane bro. 2024 and he hasn’t slowed down all that much || How is the Olympic one missing from this? || Is it crazy to say he’s back to being the number 1 pg over Luka in the nba || So far he's never lost a game after the celebration, a couple have made me nervous || You just know they going to massively f\*\*k up his night night statue. || If he did this in the 2016 finals over K. Love he might have 5 rings right now || Great compilation.

He also hit it against France when he hit 4 threes back to back. || He didn't even start doing this that long ago lol",2024-11-13
Stephen Curry with 3 PTS 1 REB 4 ASTS 4 PFS on 1/9 FG (11%) 0/6 3PT (0%) 1/1 FT (100%) splits in 21 minutes against South Sudan,,"Kerr benched him for good as soon as he saw that last 3 pointer where he got absolutely STUFFED by his defender despite his stepback || Somebody give Curry a #30 jersey or some shit they got to try something because he can't hit a fucking shot. || What not being able to spin a ball on your finger does to a man || he was playing intoxicated i’ve seen those eyes before. put the bottle down Wardell. || ive seen enough, deport him || My guy been struggling || He was COOKED today || Brother finally realised this is a Charity tournament || Bam making 2 more threes than Steph is crazy || Between this and Embiid not playing, this is r/nbacirclejerk 12/25 || Gonna be a long Olympic tourney if we're going to highlight every bad game from someone on the roster. || His defense was awful in the second half leaving guys open and getting cooked by Carlik jones || This doesn’t summarize the worst defence I’ve ever seen. Couldn’t guard a 6’1 170lb soaking wet dude from South Sudan. || Someone give Curry Draymond Green ASAP || Cooked on d too || Bro did not look good today, idk what it is but his style isn't meshing with the other stars, he keeps running into his own teammates on offense lol || Triple Single Curry || The one 3 he made didn't count lmao I know that's pain || Chef Curry without the spice || The bench doesn't have enough seats",2024-07-31
Steph Curry praises Kamala Harris and hopes US Olympic team can unite divided country | Stephen Curry ,,"The US Olympic team can’t even unite this sub || Who does Steph think he is, Caitlin Clark and Angel Reese? || Narrator:  *It will not in fact heal the nation* || I see Steph likes Kamala Harris, but not as much as Wiggins 💀 || Howcomes NBA players are soo open with their political views but NFL players shy away from political talk? I am from the UK so excuse me if this is a dumb question... || In my multiverse Harris is telling Curry that some shots are worth an additional point in this photo  || Lol Curry saw Kuzma wildin and promptly shut his ass up. 

(I don’t think the two players’ comments are actually related. Just a joke, lol.) || Need Jonathan Isaac on this team to truly unite the country || Still think Biden & Bron in a father time ad would have been legendary :i || Someone get Steph a Pepsi || Steph's comments have divided this thread lol. || The disconnect from entertainers to regular people is hilarious. || This thread survived? I'm impressed. || F her || spoiler: it won't || It can’t but I appreciate the effort.  || Yea, I don’t think so Steph. || Says the guy who wont let townhomes be built near him.
Edit: I am on board with uniting the country and what not, just thought its sort of ironic for NIMBY. || Such delusion to think a game of basketball can unify the country. Confirms sports people should stick to talking about sports. || Let’s Gooo!!!!",2024-07-25
[Haynes] Western Conference All-Star Reserves: - Stephen Curry - Kawhi Leonard - Anthony Davis - Karl-Anthony Towns - Paul George - Anthony Edwards - Devin Booker,,"I was not expecting KAT at all. Was expecting a 1% chance of Rudy. What the hell || Two Wolves allstars, with a potential DPOY season from Rudy? Minnesota fans have dreamed of this season for decades || No Sabonis or Fox is wild man || Sorry Kings fans || After watching Sabonis cook the Heat last night, snubbed || Alpi Nation, we go again next year. 🫡  

The bigger snub is Sabonis anyways… what a joke but can’t say I’m surprised either. || Where's the league leader in double-doubles? || No sabonis or rudy? || No Kings is crazy || No Sabonis or Fox feels so wrong || Kings got shafted, one of them has to get in || No Sabonis or Fox is bs. || Sabonis snubbed big time || I have no idea how Sabonis doesn't make it

19.9 Pts, 13 REBs, 8 Assists per game. 29 double doubles, 13 triple doubles

12th in efficiency, **5th** in win shares. Has counting stats and advanced stats

It's an absolute joke to not reward these types of numbers w an All-Star nod || Kings got screwed. || Winning matters unless you play in Sacramento. || Sabonis was robbed || Lmao end me || [deleted] || The Kings should have had at least one in this selection as well as Lauri should have been in consideration as well",2024-02-01
"[Charania] Stephen Curry vs. Sabrina Ionescu on All-Star Saturday night is official: Curry will shoot from the NBA 3-point line with NBA basketballs, and Ionescu will shoot from the WNBA 3-point line with WNBA basketballs. Both will receive money for their charities.",,"She said she'd shoot from the NBA line

[https://twitter.com/sabrina\_i20/status/1752403977063538901](https://twitter.com/sabrina_i20/status/1752403977063538901) || Did someone say charity? My boy is cooked. || He’s gonna lose lol || Charities and Steph…. Ive seen this movie before 😅 || Congrats Sabrina on your win. || Charity? Ionescu just needs to hit 1 to beat him then? || Congrats on the W Sabrina! Charity Steph doesn't stand a chance || In all seriousness this is pretty cool. Props to Steph a lot of players wouldn't do something like this || they should have also invited that other guy who holds the record for most 3 point shots who got cooked by Kenny Smith || Looking forward to it but man I can already see the toxic discourse this will have no matter who wins || /r/nbacirclejerk 12/25 || twitter is going to reach a new special level of hell || Steph about to miss every shot || I imagine some people will bitch but this is the most fair way to do this. Even Steph using a WNBA ball, even though it’s smaller, would be harder for him since it’s different from the ball he’s been using his whole adult life

Should be fun though. Sabrina got it in the bag since it’s for charity though.

Edit: I’ve also just learned that the difference in distance is not that much. If you google it you see 20 feet 6 inches for the WNBA line but it appears that’s outdated and the WNBA has since matched their 3PT line to the international line. [22 feet in the corners, 23 feet 9 inches around the Arc in the NBA, vs 22.15 feet all the way in the WNBA](https://proformancehoops.com/basketball-court-dimensions/)

Technically a corner 3 in the WNBA is further than a corner 3 in the NBA lol || Gonna be a bunch of starving children this year || glad to see the hype around this by steph and sabrina actually come to fruition and i’m excited to see this go down. || The IG comments on this announcement were about as I expected. || they got to make the obstacles challenge NBA vs WNBA for charity || Should also get Caitlin Clark in this competition, I'd love to see how she is able to hang with the WNBA/NBA level talent. || Someone is going to get cooked. Won't be close",2024-01-30
[All-Access] Stephen Curry and Anthony Edwards putting up some halfcourt shots at USAB practice in London,,"As a T-Wolves fan, I've prayed for a star like ANT since KG || This is the most fun team usa we've had in a while. || Lol Steph’s screech at the end. || Ant shot that shit like a mid range jumpshot. Unreal strength. ||  this means Anthony Edwards is the best shooter of all time || I will never get tired watching anything Ant related || Ant is a dog he wants to beat everyone, you can see it. || Ant & Hali going dumb next season surrounded by all these greats || Steph lost because they probably made a bet for charity or something lol || the future is now old man || Angola's in trouble || Steph's foot was on the line on that first shot.  No $10,000 prize for him || Steph releases his half court shots just as fast as any other shot lol || Are people born with a natural touch and divine hand-eye coordination or is that something you can practice? || 😍😍 that’s ma boy 🐺 || Someone call Payton Pritchard for his services || Ok... real question: how is it so effortless? I've played basketball my whole life and still play in men's leagues (I'm 43). Why does them shooting from half court just look like a normal jumper? How do they not need to exert more effort? Even if I pull up for a shot just a couple feet behind the line, I feel like my form is altered. || I’ll never forget curry going 0-9 from half court for charity during the all star game and they had to pity just give the check anyway || George Mikan and his milk men rolling in their graves || Jesus, this man really is the best at everything 😂",2024-07-19
"Stephen Curry in win vs Celtics: 27 PTS (8-17 FG) (4-9 3P) (7-7 FT), 7 REB, 9 AST, 4 STL, 1 BLK",,"His defense has been so good, I hope history remembers how he improved at it later in his career || GSW has anti Celtics aura. Steph is crazy man || TD Steph hits different || Classic || Does that say 7 FTA for Steph? || I LOVE YOU STEPHEN WARDELL CURRY || Celtic fans let the hate out your heart regarding Steve Kerr and his Olympic rotation lol.

I believe I heard Steve Kerr suck chant lol like seriouly || That’s my clutch player of the year. || Steph ""DPOY"" Curry || I LOVE STEPH CURRY || Surgical!! || WE ARE SO FUCKING BACK || Best player in the world || they kept trying to get him on the mismatch and gave up || Steph is just hitting his prime || Give Steph An AD, Siakam, Beal, Booker, Kyrie as a second… || MADE AMERICA GREAT AGAIN || I loved Tatum leaving him wide open for that 3 lol || Imagine thinking he’s worse than tatum || Is it too early to say The Warriors are better without Klay?",2024-11-06
Stephen Curry reacts to new teammates Klay Thompson and Dereck Lively ,,"This title gave me a heart attack || Anyone else read this and thought curry just for got traded to the mavs || I thought Steph linked up with Luka & Kyrie. Would’ve been generational hoops || My heart is broken still that Klay isn’t with the Dubs anymore. || I thought GSW got Lively completely forgetting Klay dipped || this happened where? || Why tf Lively rub his hands like an evil villain lmao || I had the game on mute and realized Steph and Klay were there but sitting essentially across from each other and got immediately sad. || Im so happy for DLively II || So this is what being a child of divorce feels like || Long time Rocket fan so I always seen Steph as a nemesis but after watching the Olympics son is an American legend for real. No Steph slander will be tolerated. || This offseason has been so filled with popcorn bs that I completely forgot Klay was with the Mavs now lol || [lively in this clip](https://m.youtube.com/watch?v=YZtiDJqVYwk) || Good to see Klay happy. I hope it works out for him over there in Dallas but I think that's more on his mental outlook than what happens on the court. || Steph when he sees some low income housing residents || The title is proof that words and phrasing matter 

Steph still being friends/friendly with Klay is another example of how weird fans are to create these hateful narratives between players, almost all of these guys are friends like Lebron and Steph, it's their fans who spend 10 hours a day arguing about them like it's a war lol || Lively seems like a really good dude. Dude is always smiling in every non-basketball clip I see him in, even though he had one of the toughest off-court years imaginable. 

And it's going to be really weird when Dallas & Klay play the Warriors. || Steph and Klay look the same height here || Steph cries to his pillow at night about Klay being in Dallas with Chicagos “You’re my inspiration” playing.

He probably doesn’t but it’s a nice thought to have. || You know Steph meant that shit too lol",2024-09-08
[NBAPR] The 2023-24 Kia All-NBA Third Team: ▪️ Devin Booker of @Suns ▪️ Stephen Curry of @warriors ▪️ Tyrese Haliburton of @Pacers ▪️ LeBron James of @Lakers ▪️ Domantas Sabonis of @SacramentoKings,,"The Domantas Sabonis voter has finally won his war || LeBron's 20th all NBA selection, all time record for all NBA selections || Congrats on the super max Hali || Hali getting PAID || Halliburton sacrificed his health for that bag. Looks like it’s paid off. || were there any snubs this year? brown, maxey maybe? || How did Kawhi make second team over Lebron? Damn. || Kawhi over bron gimmick in 2024 lmaooo || what type of blackmail does Kawhi have on the NBA??? || Yay Sabonis made it. || Sabonis is one of the 15 best players in the league, but not one of the best 24 players in the league. || No Jaylen Brown? 😭 || Jaylen Brown snub || Did right by Sabonis. Him not making the all star game was a bad joke. || Tyrese Haliburton contract pity || LeBron should be in the 2nd Team. 

How did Kawhi outplayed LeBron? 

LeBron - 25/7/8 - 54%/41%/75% - 71 games

Kawhi - 24/6/3 - 52%/41%/88% - 68 games

How? || Hell yea, Tyrese made it. Good shit.

Jaylen Brown didn't make it, though oof. But at least it doesn't impact his contract at all.

Hope it gives him more motivation to dominate in this playoff run. || Kawhi over Bron is crazy || this is the only sabonis vote that isn’t bad he led the league in triple doubles this year and had the double double streak || Jaylen Brown was too good this season to not be All-NBA",2024-05-22
"[All-Access] Stephen Curry made three bounce shot threes in a row at USABMNT practice






",,"Good thing AD wasn't there, he'd be grabbing the balls off the bounce as if Stephen Curry was just airballing it. || Would these count as 3 points in a game? || Steph is a genetic freak. || It was hilarious watching the other Olympic teams' benches when Steph started going off. They were DISGUSTED but also amazed but in despair. There was really nothing they could have done other than tackle him. || the secret is to twerk at the right moment || There truly will never be another. || He is Bullseye if Bullseye decided to play basketball. || Wtf was that after the second shot? Lmao. What a goof. || This is why you never ever do the fake video. No one will ever trust. || Honest question: is this were to ever happen in a game how would it be scored? || The fact that he knew the 1st one was going in immediately is crazy. The dude is just unreal || If he shot this at the buzzer in a real game, the buzzer sounds just after it leaves his hands, before the first bounce - does it count? || i assume if something like this happens in game, the ball would be treated like a loose ball after the bounce and the points would be credited to whichever offensive player is closest to the bounce spot || The twerk after the 2nd make though🤣 || I have been saying for years that Steph deserves to be in a different category than ""shooter"".  I call him a ""Ball Pilot"". || ngl the fact that that other vid was a fake is making me distrust all the trickshot vids now || This guy isn’t human || We've seen this already || He's about to change the game again. || telling my kids this is AI bc i've never seen something like this ever",2024-08-20
